{
    "$schema": "./schema/retry-after.schema.json",
    "description": "How a Retry-After header value reads as seconds from `now`: delta-seconds or an HTTP-date. `expected_seconds` is the RAW value, before the cap: null when the header is absent or unreadable (the caller falls back to its own backoff), 0 for a date in the past. The cap (`max_delay_seconds`) is applied afterwards by the caller, and graded in backoff.json.",
    "version": 1,
    "max_delay_seconds": 30,
    "cases": [
        {
            "id": "delta",
            "description": "delta-seconds",
            "header": "5",
            "now": "2026-10-01T12:00:00Z",
            "expected_seconds": 5
        },
        {
            "id": "zero",
            "description": "zero delta-seconds: retry at once",
            "header": "0",
            "now": "2026-10-01T12:00:00Z",
            "expected_seconds": 0
        },
        {
            "id": "leading-zeros",
            "description": "delta-seconds with leading zeros",
            "header": "005",
            "now": "2026-10-01T12:00:00Z",
            "expected_seconds": 5
        },
        {
            "id": "large",
            "description": "20 digits: read as a number, not refused; the cap is applied separately, so this is the raw value",
            "header": "99999999999999999999",
            "now": "2026-10-01T12:00:00Z",
            "expected_seconds": 100000000000000000000
        },
        {
            "id": "huge",
            "description": "309 digits overflow to infinity in both languages; the cap then makes it 30s",
            "header": "999999999999999999999999999999999999999999999999999999999999999999999999999999999999999999999999999999999999999999999999999999999999999999999999999999999999999999999999999999999999999999999999999999999999999999999999999999999999999999999999999999999999999999999999999999999999999999999999999999999999999999999",
            "now": "2026-10-01T12:00:00Z",
            "expected_seconds": {
                "$number": "Infinity"
            }
        },
        {
            "id": "cap-boundary",
            "description": "above the cap: recorded raw, the cap is applied separately",
            "header": "31",
            "now": "2026-10-01T12:00:00Z",
            "expected_seconds": 31
        },
        {
            "id": "imf",
            "description": "IMF-fixdate (RFC 9110's preferred form), 30s ahead",
            "header": "Thu, 01 Oct 2026 12:00:30 GMT",
            "now": "2026-10-01T12:00:00Z",
            "expected_seconds": 30
        },
        {
            "id": "rfc850",
            "description": "RFC 850 date, 60s ahead",
            "header": "Thursday, 01-Oct-26 12:01:00 GMT",
            "now": "2026-10-01T12:00:00Z",
            "expected_seconds": 60
        },
        {
            "id": "imf-past",
            "description": "IMF-fixdate in the past: retry now",
            "header": "Sun, 06 Nov 1994 08:49:37 GMT",
            "now": "2026-10-01T12:00:00Z",
            "expected_seconds": 0
        },
        {
            "id": "imf-now",
            "description": "IMF-fixdate equal to now: retry now",
            "header": "Thu, 01 Oct 2026 12:00:00 GMT",
            "now": "2026-10-01T12:00:00Z",
            "expected_seconds": 0
        },
        {
            "id": "rfc850-past",
            "description": "RFC 850 date in the past (two-digit year 94 is 1994)",
            "header": "Sunday, 06-Nov-94 08:49:37 GMT",
            "now": "2026-10-01T12:00:00Z",
            "expected_seconds": 0
        },
        {
            "id": "asctime-past",
            "description": "asctime date in the past; in the past in every time zone, so it is 0 wherever it is read",
            "header": "Sun Nov  6 08:49:37 1994",
            "now": "2026-10-01T12:00:00Z",
            "expected_seconds": 0
        },
        {
            "id": "weekday-mismatch",
            "description": "the weekday does not match the date; it is ignored",
            "header": "Mon, 01 Oct 2026 12:00:10 GMT",
            "now": "2026-10-01T12:00:00Z",
            "expected_seconds": 10
        },
        {
            "id": "lower-weekday",
            "description": "a lower-case weekday is not an HTTP-date",
            "header": "thu, 01 Oct 2026 12:00:30 GMT",
            "now": "2026-10-01T12:00:00Z",
            "expected_seconds": null
        },
        {
            "id": "two-digit-year-imf",
            "description": "an IMF-fixdate with a two-digit year (26) is read as 2026",
            "header": "Thu, 01 Oct 26 12:00:30 GMT",
            "now": "2026-10-01T12:00:00Z",
            "expected_seconds": 30
        },
        {
            "id": "rfc850-year-49",
            "description": "RFC 850 two-digit year 49 is read as 2049 by both",
            "header": "Friday, 01-Oct-49 12:00:00 GMT",
            "now": "2026-10-01T12:00:00Z",
            "expected_seconds": 725846400
        },
        {
            "id": "rfc850-year-70",
            "description": "RFC 850 two-digit year 70 is read as 1970 by both (RFC 9110's 50-year rule would say 2070: both SDKs agree on 1970 today)",
            "header": "Wednesday, 01-Oct-70 12:00:00 GMT",
            "now": "2026-10-01T12:00:00Z",
            "expected_seconds": 0
        },
        {
            "id": "offset-zone",
            "description": "a numeric zone offset is honoured: 13:00:30 +0100 is 12:00:30 GMT",
            "header": "Thu, 01 Oct 2026 13:00:30 +0100",
            "now": "2026-10-01T12:00:00Z",
            "expected_seconds": 30
        },
        {
            "id": "day-32",
            "description": "day 32 is not a date",
            "header": "Thu, 32 Oct 2026 12:00:00 GMT",
            "now": "2026-10-01T12:00:00Z",
            "expected_seconds": null
        },
        {
            "id": "hour-25",
            "description": "hour 25 is not a time",
            "header": "Thu, 01 Oct 2026 25:00:00 GMT",
            "now": "2026-10-01T12:00:00Z",
            "expected_seconds": null
        },
        {
            "id": "year-overflow",
            "description": "a year too large to represent (20 digits) is unreadable, not an error",
            "header": "Thu, 01 Oct 99999999999999999999 12:00:00 GMT",
            "now": "2026-10-01T12:00:00Z",
            "expected_seconds": null
        },
        {
            "id": "fraction",
            "description": "not delta-seconds: a fraction",
            "header": "1.5",
            "now": "2026-10-01T12:00:00Z",
            "expected_seconds": null
        },
        {
            "id": "negative",
            "description": "not delta-seconds: a sign",
            "header": "-1",
            "now": "2026-10-01T12:00:00Z",
            "expected_seconds": null
        },
        {
            "id": "plus",
            "description": "not delta-seconds: a plus sign",
            "header": "+5",
            "now": "2026-10-01T12:00:00Z",
            "expected_seconds": null
        },
        {
            "id": "exponent",
            "description": "not delta-seconds: exponent notation",
            "header": "1.5e3",
            "now": "2026-10-01T12:00:00Z",
            "expected_seconds": null
        },
        {
            "id": "superscript",
            "description": "not delta-seconds: a Unicode digit that is not ASCII",
            "header": "²",
            "now": "2026-10-01T12:00:00Z",
            "expected_seconds": null
        },
        {
            "id": "arabic-digit",
            "description": "not delta-seconds: an Arabic-Indic digit",
            "header": "٣",
            "now": "2026-10-01T12:00:00Z",
            "expected_seconds": null
        },
        {
            "id": "iso-date",
            "description": "an ISO 8601 date is not an HTTP-date",
            "header": "2026-10-01",
            "now": "2026-10-01T12:00:00Z",
            "expected_seconds": null
        },
        {
            "id": "prose-date",
            "description": "a date that does not start with a weekday is not an HTTP-date, even if a date parser would read it",
            "header": "March 1, 2027",
            "now": "2026-10-01T12:00:00Z",
            "expected_seconds": null
        },
        {
            "id": "bad-weekday",
            "description": "an HTTP-date shape whose weekday is not a weekday",
            "header": "X, 21 Oct 2026 07:28:00 GMT",
            "now": "2026-10-01T12:00:00Z",
            "expected_seconds": null
        },
        {
            "id": "unit",
            "description": "delta-seconds with a unit",
            "header": "5 seconds",
            "now": "2026-10-01T12:00:00Z",
            "expected_seconds": null
        },
        {
            "id": "empty",
            "description": "an empty value",
            "header": "",
            "now": "2026-10-01T12:00:00Z",
            "expected_seconds": null
        },
        {
            "id": "spaces",
            "description": "whitespace only",
            "header": "   ",
            "now": "2026-10-01T12:00:00Z",
            "expected_seconds": null
        },
        {
            "id": "padded",
            "description": "surrounding spaces are trimmed",
            "header": " 5 ",
            "now": "2026-10-01T12:00:00Z",
            "expected_seconds": 5
        },
        {
            "id": "tab",
            "description": "surrounding tabs are trimmed",
            "header": "\t5\t",
            "now": "2026-10-01T12:00:00Z",
            "expected_seconds": 5
        },
        {
            "id": "absent",
            "description": "no Retry-After header at all",
            "header": null,
            "now": "2026-10-01T12:00:00Z",
            "expected_seconds": null
        },
        {
            "id": "asctime",